{
    "$schema": "../Floor.schema.json",
    "id": "rectoriaITESM-4", 
    "boundingBox": [[0, 0], [800, 600]], 
    "name": "Rectoria Piso 4", 
    "spaces": [
        {
            "id": "rectoriaITESM-4.01", 
            "name": "Sala de espera", 
            "vertices": [
                [306.21722412109375, 201.27340698242188],
                [306.21722412109375, 416.40447998046875],
                [497.9775390625, 202.47190856933594],
                [497.9775390625, 417.6029968261719]
            ] 
        },
        {
            "id": "rectoriaITESM-04.02", 
            "name": "Asistentes rectoria", 
            "vertices": [
                [175.5805206298828, 119.17603302001953],
                [172.5842742919922, 197.6779022216797],
                [381.72283935546875, 199.4756622314453],
                [381.12359619140625, 118.5767822265625]
            ]
        }
    ]
}